{
  "format": "simulacrum-subassembly",
  "version": 1,
  "name": "Reusable beam",
  "accent": "#70e0c4",
  "parts": [
    {
      "id": 1,
      "type": "beam",
      "pos": [0, 0, 0],
      "orientation": [0, 0, 0, 1],
      "scale": { "x": 1, "y": 1, "z": 1 },
      "config": { "mass": 18, "size": [2.4, 0.35, 0.35] }
    }
  ],
  "connections": [],
  "exposedPorts": []
}
